{
  "pattern_candidate_id": "PC-001",
  "source_cases": [
    "VC-101",
    "VC-103"
  ],
  "generated_at": "2026-06-28T16:00:00+00:00",
  "status": "Candidate",
  "pattern_tags": [
    "corporate_disclosure"
  ],
  "feature_summary": "Rule-matched Verified Case tags: filing or exchange.",
  "similarity_score": 1.0,
  "review_required": true,
  "model_impact": "repository_only"
}
